1427C, The Hard Work of Paparazzi, dp, , 2000, x3842, 
1427B, Chess Cheater, greedy implementation sortings, , 1400, x7595, 
1427A, Avoiding Zero, math sortings, , 900, x12185, 
1426F, Number of Subsequences, combinatorics dp strings, , 2000, x3097, 
1426E, Rock Paper Scissors, brute force constructive algorithms flows greedy math, , 1800, x5055, 
1426D, Non-zero Segments, constructive algorithms data structures greedy sortings, , 1500, x9059, 
1426C, Increase and Copy, binary search constructive algorithms math, , 1100, x13024, 
1426B, Symmetric Matrix, implementation, , 900, x15217, 
1426A, Floor Number, implementation math, , 800, x22391, 
1425I, Impressive Harvesting of The Orchard, data structures, , 2800, x125, 
1425H, Huge Boxes of Animal Toys, constructive algorithms, , 1300, x2592, 
1425F, Flamingoes of Mystery, interactive, , 1400, x2486, 
1425E, Excitation of Atoms, greedy implementation, , 2200, x664, 
1425D, Danger of Mad Snakes, combinatorics dp math, , 2300, x549, 
1425C, Captain of Knights, math, , 3100, x17, 
1425B, Blue and Red of Our Faculty!, divide and conquer dp, , 2600, x165, 
1425A, Arena of Greed, games greedy, , 1400, x3397, 
1424M, Ancient Language, graphs sortings, , 2200, x365, 
1424G, Years, data structures sortings, , 1300, x2541, 
1423N, BubbleSquare Tokens, , , 3500, x36, 
1423M, Milutin's Plums, interactive, , 2800, x76, 
1423L, Light switches, meet-in-the-middle, , 2600, x217, 
1423K, Lonely Numbers, binary search math number theory two pointers, , 1600, x2416, 
1423J, Bubble Cup hypothesis, bitmasks constructive algorithms dp math, , 2400, x492, 
1423I, Lookup Tables, bitmasks, , 3000, x47, 
1423H, Virus, data structures divide and conquer dsu graphs, , 2500, x286, 
1423G, Growing flowers, data structures, , 3500, x26, 
1423F, Coins, math, , 2700, x168, 
1423E, 5G Antenna Towers, geometry, , 2700, x35, 
1423D, Does anyone else hate the wind?, , , 3100, x11, 
1423C, Dušan's Railway, divide and conquer graphs trees, , 3500, x30, 
1423B, Valuable Paper, binary search flows graph matchings graphs, , 1900, x1193, 
1423A, Wakanda Forever, , , 3500, x26, 
1422F, Boring Queries, data structures math number theory, , 2700, x377, 
1422E, Minlexes, dp greedy implementation strings, , 2700, x517, 
1422D, Returning Home, graphs shortest paths sortings, , 2300, x1881, 
1422C, Bargain, combinatorics dp math, , 1700, x5543, 
1422B, Nice Matrix, greedy implementation math, , 1300, x10053, 
1422A, Fence, geometry math, , 800, x16113, 
1421E, Swedish Heroes, brute force dp implementation, , 2700, x448, 
1421D, Hexagons, brute force constructive algorithms greedy implementation math shortest paths, , 1900, x3256, 
1421C, Palindromifier, constructive algorithms strings, , 1400, x8421, 
1421B, Putting Bricks in the Wall, constructive algorithms implementation, , 1100, x10252, 
1421A, XORwice, bitmasks greedy math, , 800, x15707, 
1420E, Battle Lemmings, dp greedy, , 2500, x558, 
1420D, Rescue Nibel!, combinatorics data structures sortings, , 1800, x4983, 
1420C2, Pokémon Army (hard version), data structures divide and conquer dp greedy implementation, , 2100, x3256, 
1420C1, Pokémon Army (easy version), constructive algorithms dp greedy, , 1300, x11180, 
1420B, Rock and Lever, bitmasks math, , 1200, x13300, 
1420A, Cubes Sorting, math sortings, , 900, x16522, 
1419F, Rain of Fire, binary search data structures dfs and similar dsu graphs implementation, , 2800, x318, 
1419E, Decryption, constructive algorithms implementation math number theory, , 2100, x2439, 
1419D2, Sage's Birthday (hard version), binary search brute force constructive algorithms greedy sortings two pointers, , 1500, x9502, 
1419D1, Sage's Birthday (easy version), binary search constructive algorithms greedy sortings, , 1000, x14360, 
1419C, Killjoy, greedy implementation math, , 1500, x10060, 
1419B, Stairs, brute force constructive algorithms greedy implementation math, , 1200, x12009, 
1419A, Digit Game, games greedy implementation, , 900, x14883, 
1418G, Three Occurrences, data structures divide and conquer hashing two pointers, , 2500, x770, 
1418F, Equal Product, data structures math number theory two pointers, , 3000, x192, 
1418E, Expected Damage, binary search combinatorics probabilities, , 2400, x1177, 
1418D, Trash Problem, data structures implementation, , 2100, x3153, 
1418C, Mortal Kombat Tower, dp graphs greedy shortest paths, , 1500, x9740, 
1418B, Negative Prefixes, greedy sortings, , 1300, x11724, 
1418A, Buying Torches, math, , 1000, x14934, 
1417B, Two Arrays, greedy math sortings, , 1100, x10570, 
1417A, Copy-paste, greedy math, , 800, x14707, 
