1496B, Max and Mex, implementation math, , , x7640, 
1496A, Split it!, brute force constructive algorithms greedy strings, , , x9476, 
1495F, Squares, constructive algorithms data structures graphs, , , x21, 
1495E, Qingshan and Daniel, brute force data structures greedy implementation, , , x43, 
1495D, BFS Trees, combinatorics dfs and similar graphs math shortest paths trees, , , x313, 
1495C, Garden of the Sun, constructive algorithms graphs, , , x862, 
1495B, Let's Go Hiking, constructive algorithms games greedy implementation, , , x2390, 
1495A, Diamond Miner, geometry greedy math sortings, , , x7614, 
1494F, Delete The Edges, brute force constructive algorithms dfs and similar graphs implementation, , 2900, x166, 
1494E, A-Z Graph, constructive algorithms data structures graphs hashing, , 2400, x932, 
1494D, Dogeforces, constructive algorithms data structures dfs and similar divide and conquer dsu greedy sortings trees, , 2300, x1465, 
1494C, 1D Sokoban, binary search dp greedy implementation two pointers, , 1900, x3239, 
1494B, Berland Crossword, bitmasks brute force greedy implementation, , 1400, x8119, 
1494A, ABC String, bitmasks brute force implementation, , 900, x13151, 
1493F, Enchanted Matrix, bitmasks interactive number theory, , 2600, x143, 
1493E, Enormous XOR, bitmasks constructive algorithms greedy math strings two pointers, , 2600, x371, 
1493D, GCD of an Array, data structures hashing implementation math number theory sortings two pointers, , 2100, x2310, 
1493C, K-beautiful Strings, binary search brute force constructive algorithms greedy strings, , 2000, x2463, 
1493B, Planet Lapituletti, brute force implementation, , 1300, x7599, 
1493A, Anti-knapsack, constructive algorithms greedy, , 800, x12707, 
1492E, Almost Fault-Tolerant Database, brute force constructive algorithms dfs and similar greedy implementation, , 2500, x780, 
1492D, Genius's Gambit, bitmasks constructive algorithms greedy math, , 1900, x3902, 
1492C, Maximum width, binary search data structures dp greedy two pointers, , 1500, x8112, 
1492B, Card Deck, data structures greedy math, , 1100, x11388, 
1492A, Three swimmers, math, , 800, x15135, 
1491I, Ruler Of The Zoo, brute force data structures, , 3500, x15, 
1491H, Yuezheng Ling and Dynamic Tree, data structures trees, , 3400, x184, 
1491G, Switch and Flip, constructive algorithms graphs math, , 2800, x323, 
1491F, Magnets, binary search constructive algorithms interactive, , 2700, x518, 
1491E, Fib-tree, brute force dfs and similar divide and conquer number theory trees, , 2400, x1258, 
1491D, Zookeeper and The Infinite Zoo, bitmasks constructive algorithms dp greedy math, , 1800, x4065, 
1491C, Pekora and Trampoline, brute force data structures dp greedy implementation, , 1700, x4746, 
1491B, Minimal Cost, brute force math, , 1200, x9425, 
1491A, K-th Largest Value, brute force greedy implementation, , 800, x13287, 
1490G, Old Floppy Drive, binary search data structures math, , 1900, x3239, 
1490F, Equalize the Array, binary search data structures greedy math sortings, , 1500, x6979, 
1490E, Accidental Victory, binary search data structures greedy, , 1400, x8407, 
1490D, Permutation Transformation, dfs and similar divide and conquer implementation, , 1200, x10510, 
1490C, Sum of Cubes, binary search brute force math, , 1100, x14504, 
1490B, Balanced Remainders, brute force constructive algorithms math, , 1000, x14837, 
1490A, Dense Array, greedy math, , 800, x18690, 
1488J, Flower Shop, *special problem data structures fft math, , , x4, 
1488I, Demonic Invasion, *special problem flows, , , x12, 
1488H, Build From Suffixes, *special problem combinatorics data structures, , , x21, 
1488G, Painting Numbers, *special problem data structures greedy number theory, , , x60, 
1488F, Dogecoin, *special problem binary search data structures, , , x86, 
1488E, Palindromic Doubles, *special problem data structures dp, , , x122, 
1488D, Problemsolving Marathon, *special problem binary search greedy, , , x187, 
1488C, Two Policemen, *special problem binary search brute force math, , , x236, 
1488B, RBS Deletion, *special problem greedy, , , x317, 
1488A, From Zero To Y, *special problem math, , , x638, 
1487G, String Counting, combinatorics dp fft math, , 2700, x302, 
1487F, Ones, dp greedy shortest paths, , 2900, x179, 
1487E, Cheap Dinner, brute force data structures graphs greedy implementation sortings two pointers, , 2000, x2741, 
1487D, Pythagorean Triples, binary search brute force math number theory, , 1500, x8845, 
1487C, Minimum Ties, brute force constructive algorithms dfs and similar graphs greedy implementation math, , 1500, x7551, 
1487B, Cat Cycle, math number theory, , 1200, x11156, 
1487A, Arena, implementation sortings, , 800, x17805, 
1486F, Pairs of Paths, combinatorics data structures dfs and similar dp trees, , 2600, x322, 
1486E, Paired Payment, binary search brute force constructive algorithms dp flows graphs shortest paths, , 2200, x1681, 
1486D, Max Median, binary search data structures dp, , 2100, x3282, 
1486C2, Guessing the Greatest (hard version), binary search interactive, , 1900, x4829, 
1486C1, Guessing the Greatest (easy version), binary search interactive, , 1600, x6660, 
1486B, Eastern Exhibition, binary search geometry shortest paths sortings, , 1500, x9370, 
1486A, Shifting Stacks, greedy implementation, , 900, x16051, 
1485F, Copy or Prefix Sum, combinatorics data structures dp sortings, , 2400, x1004, 
1485E, Move and Swap, dfs and similar dp greedy trees, , 2500, x745, 
1485D, Multiples and Power Differences, constructive algorithms graphs math number theory, , 2200, x3174, 
1485C, Floor and Mod, binary search brute force math number theory, , 1700, x5460, 
1485B, Replace and Keep Sorted, dp implementation math, , 1200, x9742, 
1485A, Add and Divide, brute force greedy math number theory, , 1000, x12460, 
1481F, AB Tree, dp greedy trees, , 3100, x173, 
1481E, Sorting Books, data structures dp greedy, , 2500, x1178, 
1481D, AB Graph, brute force constructive algorithms graphs greedy implementation, , 2000, x3052, 
1481C, Fence Painting, brute force constructive algorithms greedy, , 1600, x7164, 
1481B, New Colony, brute force greedy implementation, , 1100, x13856, 
1481A, Space Navigation, greedy strings, , 800, x18716, 
1480B, The Great Hero, greedy implementation sortings, , 900, x11916, 
1480A, Yet Another String Game, games greedy strings, , 800, x18087, 
1479E, School Clubs, dp fft math number theory probabilities, , 3500, x45, 
1479D, Odd Mineral Resource, binary search bitmasks brute force data structures probabilities trees, , 2900, x357, 
1479C, Continuous City, bitmasks constructive algorithms, , 2500, x827, 
1479B2, Painting the Array II, constructive algorithms data structures dp greedy implementation, , 2100, x2529, 
1479B1, Painting the Array I, constructive algorithms data structures dp greedy implementation, , 1900, x4506, 
1479A, Searching Local Minimum, binary search interactive ternary search, , 1700, x7098, 
1478C, Nezzar and Symmetric Array, implementation math sortings, , 1700, x6328, 
1478B, Nezzar and Lucky Number, brute force dp greedy math, , 1100, x13251, 
1478A, Nezzar and Colorful Balls, brute force greedy, , 800, x19143, 
1477F, Nezzar and Chocolate Bars, combinatorics fft math probabilities, , 3500, x50, 
1477E, Nezzar and Tournaments, data structures greedy, , 3300, x58, 
1477D, Nezzar and Hidden Permutations, constructive algorithms dfs and similar graphs, , 2800, x260, 
1477C, Nezzar and Nice Beatmap, constructive algorithms geometry greedy math sortings, , 2200, x1495, 
1477B, Nezzar and Binary String, data structures greedy, , 1900, x1952, 
1477A, Nezzar and Board, constructive algorithms math number theory, , 1800, x3772, 
1476G, Minimum Difference, data structures hashing sortings two pointers, , 3100, x164, 
1476F, Lanterns, binary search data structures dp, , 3000, x112, 
1476E, Pattern Matching, bitmasks data structures dfs and similar graphs hashing sortings strings, , 2300, x1539, 
1476D, Journey, dfs and similar dp dsu implementation, , 1700, x5359, 
1476C, Longest Simple Cycle, dp graphs greedy, , 1600, x7111, 
1476B, Inflation, binary search brute force greedy math, , 1300, x12204, 
                                                                                                                                                                                                                                                                                                                                                                                                                                                                                                                                                                                                                                                                                                                                                                                                                                                                                                                                                                                                                                                                                                                                                                                                                                                                                                                                                                                                                                                                                                                                                                                                                                                                                                                                                                                                                                                                                                                                                                                                                                                                                                                                                                                                                                                                                                                                                                                                                                                                                                                                                                                                                                                                                                                                                                                                                                                                                                                                                                                                                                                                                                                                                                                                                                                                                                                                                                                                                                                                                                                                                                                                                                                                                                                                                                                                                                                                                                                                                                                                                                                                                                                                                                                                                                                                                                                                                                                                                                                                                                                                                                                                                                                                                                                                                                                                                                                                                                                                                                                                                                                                                                                                                                                                                                                                                                                                                                                                                                                                                                                                                                                                                                                                                                                                                                                                                                                                                                                                                                                                                                                                                                                                                                                                                                                                                                                                                                                                                                                                                                                                                                                                                                                                                                                                                                                                                                                                                                                                                                                                                                                                                                                                                                                                                                                                                                                                                                                                                                                                                                                                                                                                                                                                                                                                                                                                                                                                                                                                                                                                                                                                                                                                                                                                                                                                                                                                                                                                                                                                                                                                                                                                                                                                                                                                                                                                                                                                                                                                                                                                                                                                                                                                                                                                                                                                                                                                                                                                                                                                                                                                                                                                                                                                                                                                                                                                                                                                                                                                                                                                                                                                                                                                                                                                                                                                                                                                                                                                                                                                                                                                                                                                                                                                                                                                                                                                                                                                                                                                                                                                                                                                                                                                                                                                                                                                                                                                                                                                                                                                                                                                                                                                                                                                                                                                                                                                                                                                                                                                                                                                                                                                                                                                                                                                                                                                                                                                                                                                                                                                                                                                                                                                                                                                                                                                                                                                                                                                                                                                                                                                                                                                                                                                                                                                                                                                                                                                                                                                                                                                                                                                                                                                                                                                                                                                                                                                                                                                                                                                                                                                                                                                                                                                                                                                                                                                                                                                                                                                                                                                                                                                                                                                                                                                                                                                                                                                                                                                                                                                                                                                                                                                                                                                                                                                                                                                                                                                                                                                                                                                                                                                                                                                                                                                                                                                                                                                                                                                                                                                                                                                                                                                                                                                                                                                                                                                                                                                                                                                                                                                                                                                                                                                                                                                                                                                                                                                                                                                                                                                                                                                              x3891, 
1430D, String Deletion, binary search data structures greedy two pointers, , 1700, x6290, 
1430C, Numbers on Whiteboard, constructive algorithms data structures greedy implementation math, , 1000, x13083, 
1430B, Barrels, greedy implementation sortings, , 800, x14806, 
1430A, Number of Apartments, brute force constructive algorithms math, , 900, x14931, 
1428H, Rotary Laser Lock, binary search interactive, , 3500, x26, 
1428G2, Lucky Numbers (Hard Version), dp greedy, , 3000, x291, 
1428G1, Lucky Numbers (Easy Version), dp greedy, , 2900, x278, 
1428F, Fruit Sequences, binary search data structures divide and conquer dp two pointers, , 2400, x1439, 
1428E, Carrots for Rabbits, binary search data structures greedy math sortings, , 2200, x2565, 
1428D, Bouncing Boomerangs, constructive algorithms greedy implementation, , 1900, x3439, 
1428C, ABBB, brute force data structures greedy strings, , 1100, x12124, 
1428B, Belted Rooms, graphs implementation, , 1200, x10355, 
1428A, Box is Pull, math, , 800, x13581, 
1427H, Prison Break, binary search games geometry ternary search, , 3500, x26, 
1427G, One Billion Shades of Grey, flows graphs, , 3300, x93, 
1427F, Boring Card Game, data structures greedy trees, , 3200, x87, 
1427E, Xum, bitmasks constructive algorithms math matrices number theory, , 2500, x787, 
1427D, Unshuffling a Deck, constructive algorithms implementation, , 2000, x2644, 
